{
  "work_id": "<work_id>",
  "genre": "玄幻仙侠·系统流·转世追妻",
  "tone": "轻松幽默与深情虐恋交织，前期以搞笑日常和苟命生存为主，中后期逐渐升华为热血战斗与深层情感羁绊，结局温馨圆满",
  "world_structure": {
    "summary": "故事横跨多个位面层级：下界修仙大陆→仙界→冥界→大千世界→蓝星（现代地球）。下界有两片主要大陆，仙界分为九州，冥界有往生桥体系，大千世界为最高层位面。蓝星（地球）存在于往生门内部的独立宇宙中。",
    "major_regions": [
      "天苍大陆（主舞台）：分为南域、中州、北境、东荒、西漠五大区域",
      "玄海大陆（又称沧海大陆）：海外大陆，冥海大帝罗天安的地盘",
      "天琼大陆（太古时代）：太古气运战界所在，通过时间回溯到达",
      "荒禁之地：东荒边缘的时间法则异常区域",
      "仙界九州：飞升后的高等位面，Character A建立道天仙府于神州",
      "冥界：亡魂归处，有往生桥、黑冥长河、冥主管辖",
      "大千世界：包含仙界、冥界等的更高层位面",
      "蓝星（地球）：Character B和冷凝月的穿越前家乡，位于往生门内独立宇宙"
    ]
  },
  "power_system": {
    "summary": "修炼体系分为下界、仙界、更高位面三个层级。下界以灵力为基础逐步凝练，突破大帝可飞升仙界。仙界以仙力修炼。大千世界有道尊以上的更高境界。此外存在特殊体质（太古冥寒体、混沌霸体、太阳剑体等）和系统辅助修炼两种额外路径。",
    "levels": [
      "【下界】淬体境 → 聚灵境 → 结灵境 → 扩灵境 → 化灵境 → 合元境 → 破元境 → 天元境 → 圣王境 → 准帝境 → 大帝境 → 半仙境",
      "【仙界】仙人境 → 仙王境 → 仙皇境 → 仙尊境 → 仙帝境",
      "【大千世界】道尊境 → 道圣境 → 道帝境 → 道主境",
      "【特殊】伪帝境（大帝级别但未正式渡劫）",
      "【兵器品级】黄器 → 玄器 → 皇器 → 王器 → 圣器 → 帝器 → 仙器"
    ]
  },
  "major_factions": [
    {
      "name": "<location>",
      "description": "北境顶级势力，Character A出身之地。有三位准帝境太上长老坐镇，冰系功法传承，宫规严禁圣女与男子产生感情。"
    },
    {
      "name": "<stage_title>",
      "description": "天苍大陆第一宗门，位于中州。<stage_title>为其南域分宗。有两位伪帝境老祖（剑闲余、剑闲鱼/剑开天），宗主剑澜为准帝境。"
    },
    {
      "name": "仙庭",
      "description": "西漠超大型宗门，有十响天资钟考核体系。仙庭老祖镇阴阳为准帝巅峰。柳青瑶（柳绫人魂）为仙庭圣女。"
    },
    {
      "name": "<location>",
      "description": "拥有天机犬等特殊存在，后被揭示为成仙坛副坛之一，天机老祖何天坤被Character B击败。"
    },
    {
      "name": "天荒圣地",
      "description": "暗中包庇圣魔教，搜寻器化神通的反派势力。"
    },
    {
      "name": "太上神宗（太古遗迹）",
      "description": "太古时代宗门，林凡和幻天莹所属。宗主分魂为仙皇境残魂。后成为Character A获得冰仙传承的关键地点。"
    },
    {
      "name": "道天仙府",
      "description": "Character A在仙界建立的势力，位于神州。仙界三大禁忌之一即不可提及寒仙<character>的情缘往事。"
    },
    {
      "name": "方天与罗天安联盟",
      "description": "两位半仙境大帝，企图通过成仙坛血祭两片大陆成仙。方天为天苍血魔大帝，罗天安为玄海冥海大帝。最终被Character B等人联手击败。"
    }
  ],
  "world_lines": [
    {
      "name": "天苍南域篇",
      "chapter_range": "0001-0085",
      "core_conflict": "Character B第九世复活后在南域求生、与破境重修的Character A相遇相识，逐步积攒实力",
      "setting_features": "南域柳村→东阳皇朝→<stage_title>→中州<stage_title>→北境<location>，以低境界冒险和身份隐藏为主"
    },
    {
      "name": "<location>与中州篇",
      "chapter_range": "0086-0168",
      "core_conflict": "Character B在<location>伪装失忆与Character A博弈，部分身份暴露后被迫分离；独自前往中州寻找龙蛋，浴血重逢后发现成仙坛阴谋",
      "setting_features": "北境<location>生活、中州独行冒险、成仙坛副本首次出现、Character A身份从杀六世知情升级"
    },
    {
      "name": "修炼与帝陨秘境篇",
      "chapter_range": "0169-0243",
      "core_conflict": "三年修炼后进入帝陨秘境，Character B与Character A确认道侣关系；醉酒暴露八世真相导致关系崩裂分离",
      "setting_features": "<stage_title>三年时间跳跃、帝陨秘境长期探索、幻天大帝残魂登场、感情从确认到破裂的大起大落"
    },
    {
      "name": "东荒与太古时代篇",
      "chapter_range": "0244-0328",
      "core_conflict": "Character B独行后与Character A在东荒重逢并坦白身份；穿越至太古时代天琼大陆参加气运战界，击败各路天骄晋升准帝",
      "setting_features": "仙庭、东荒城池、太古天琼大陆、气运战界竞技场、荒禁困境、成仙梯"
    },
    {
      "name": "玄海与天苍决战篇",
      "chapter_range": "0329-0394",
      "core_conflict": "玄海大陆短暂停留后回归天苍；太上神宗传承后天苍大劫降临，联合各方对抗半仙方天，Character B以命换命击杀方天后第九世身死",
      "setting_features": "玄海大陆游历、再入帝陨秘境、太上神宗传承、天苍大劫两片大陆碰撞的终极战役"
    },
    {
      "name": "仙界篇",
      "chapter_range": "0395-0505",
      "core_conflict": "Character B万年后在仙界复活，Character A记忆被封；逐步恢复记忆、大婚、获得无敌实力；前往冥界完成使命后复活众多已故之人",
      "setting_features": "仙界道天仙府为主场、寒仙<character>威名、系统任务驱动寻人救人、冥界探险、往生术复活机制"
    },
    {
      "name": "蓝星篇（结局）",
      "chapter_range": "0506-0537",
      "core_conflict": "众人回到蓝星（现代地球）定居，Character A怀孕生下双胞胎女儿，与前世转世者重逢，全员幸福结局",
      "setting_features": "现代都市背景、修仙者在蓝星的日常反差萌、转世重逢的感动、新生命诞生的温馨收尾"
    }
  ],
  "core_rules": [
    "九命转世机制：Character B因系统拥有九条命，前八世均死于Character A之手，第九世为最后一条命。系统可消耗巨量本源点复活宿主（第十世在仙界复活）。",
    "系统本源点经济：Character B拥有主神级系统，通过击杀、搜刮、任务等方式获取本源点，用于购买物品、突破境界、复活等。系统有独立意识和情感。",
    "<technique>禁欲限制：Character A修炼的<technique>要求在大帝境之前不得失身，否则寒阴之气散失、修为倒退。这是二人关系发展的关键限制。",
    "大道之女设定：Character A是大道之女，本应主宰大千世界。Character B与她结合后系统窃取了大道力量，使Character B获得无敌实力。",
    "九色大气运与大道气运互相吸引：这是Character B和Character A十世相遇的根本原因，并非偶然。",
    "帝尸回归度机制：Character B第八世的帝尸被Character A保存在神海空间中，随着回归度提升可与Character B本体融合，最终在天苍大劫中完成100%融合。",
    "天道规则：天道会镇压超越常理的存在（如幻天莹），会在突破时降下雷劫。Character A曾与天道金身交战并逼迫其签订契约给予万年等待期。",
    "往生术：Character B在冥界获得的逆天神通，可将亡魂回溯往生、恢复生前肉身。不可外传。",
    "时间流速差异：蓝星与修仙界时间流速为一天比一千年。"
  ]
}