{
  "work_id": "<work_id>",
  "genre": "玄幻修仙·系统流·甜宠",
  "tone": "以轻松搞笑和甜蜜互动为主基调，穿插热血战斗与深情虐恋，后期逐渐走向温馨日常",
  "world_structure": {
    "summary": "故事横跨四个层级的世界：下界（天苍大陆与玄海大陆）→ 仙界 → 大千世界 → 蓝星（地球）。下界以天苍大陆为主舞台，分为南域、中州、北境、东荒、西漠五大区域。仙界由九州组成，其中神州的道天仙府为主要据点。大千世界包含冥界等多个位面。蓝星为男主家乡，是往生门通道连接的现实世界。",
    "major_regions": [
      "天苍大陆·南域 — 柳村、<stage_title>所在地，主角起始区域",
      "天苍大陆·中州 — 大陆中心，<stage_title>主宗、<location>所在",
      "天苍大陆·北境 — <location>所在地，极寒之地",
      "天苍大陆·东荒 — 荒禁禁地入口，时空法则混乱区域",
      "天苍大陆·西漠 — 仙庭所在地，太上神宗遗址隐藏地",
      "玄海大陆 — 海外大陆，罗天安势力范围",
      "仙界·神州 — 道天仙府所在，<character>的势力中心",
      "仙界·界州 — 镇魔城所在，萧浩支线发生地",
      "仙界·寒州 — 冰渊神宗所在，冷凝月支线发生地",
      "大千世界·冥界 — 黑冥长河、往生桥所在",
      "大千世界·宝婴界 — 苍生大树，双胞胎出生地",
      "蓝星（地球） — 男主家乡，全书结局定居地"
    ]
  },
  "power_system": {
    "summary": "修炼体系分三大阶段：下界修仙境界、仙界境界、大千世界境界。修炼以灵力（下界）→仙力（仙界）→大道之力（大千）为核心能量。特殊体质（混沌霸体、太古冥寒体、太阳剑体、太阴剑体等）可大幅提升战力。男主额外拥有系统提供的本源点兑换机制和九大神通。",
    "levels": [
      "【下界】淬体 → 聚灵 → 结灵 → 扩灵 → 化灵 → 合元 → 破元 → 天元 → 圣王 → 准帝 → 大帝 → 半仙",
      "【仙界】仙人境 → 仙王境 → 仙皇境 → 仙尊境 → 仙帝境",
      "【大千世界】道尊 → 道圣 → 道帝 → 道主 → ??? (管理者级别)",
      "【兵器等阶】凡器 → 玄器 → 皇器 → 圣器 → 帝器 → 仙器"
    ]
  },
  "major_factions": [
    {
      "name": "<location>",
      "description": "北境女修宗门，历代宫主均为<character>级强者。三大禁忌：恋情、叛反、入魔。女主Character A为现任宫主（破境重修后身份），三位太上长老为核心战力。"
    },
    {
      "name": "<stage_title>",
      "description": "天苍大陆第一宗门，位于中州。宗主剑澜（准帝中期），暗藏两位伪帝境老祖（剑闲余、剑开天）。<stage_title>为其南域分宗。"
    },
    {
      "name": "仙庭",
      "description": "西漠大宗门，天资钟可鉴定资质。老祖镇阴阳为准帝巅峰。男主被尊为'十响神子'。"
    },
    {
      "name": "<location>",
      "description": "以情报和推算闻名的势力，老祖何天坤（准帝后期巅峰）。暗中设有方天的成仙坛副坛。天机犬（哈弟）原属此势力。"
    },
    {
      "name": "天荒圣地",
      "description": "表面正道宗门，实为包庇圣魔教的幕后势力之一，其老祖搜寻九大神通。"
    },
    {
      "name": "圣魔教",
      "description": "魔道势力，在中州各处设有血祭祭坛，实为方天成仙坛计划的执行者。"
    },
    {
      "name": "道天仙府",
      "description": "仙界顶级势力，位于神州。Character A飞升仙界后以一己之力平息仙界动乱，道天仙府为其势力中心。"
    },
    {
      "name": "太上神宗",
      "description": "太古时代顶级宗门，林凡与幻天莹曾隶属于此。遗址藏于西漠地底，保存有冰仙三代传承功法和大量宝物。"
    },
    {
      "name": "冰渊神宗",
      "description": "仙界寒州宗门，冷凝月被迫入门后又被安排联姻太上神宗。"
    }
  ],
  "world_lines": [
    {
      "name": "南域起步篇",
      "chapter_range": "约1-38",
      "core_conflict": "男主第九世复活，在柳村与破境重修的<character>初遇。从仇人关系逐步建立信任，收徒萧浩。",
      "setting_features": "天苍大陆南域——柳村、<stage_title>、荒野城镇。凡人与低阶修士的世界。"
    },
    {
      "name": "宗门历练篇",
      "chapter_range": "约39-115",
      "core_conflict": "<stage_title>比试、东阳皇宫偷宝、入<location>修炼。男女主从追逐到师徒关系确立，身份伏笔层层铺开。",
      "setting_features": "<stage_title>→东阳皇宫→中州<stage_title>→北境<location>。宗门体系与修仙界规则逐步展开。"
    },
    {
      "name": "中州风云篇",
      "chapter_range": "约116-168",
      "core_conflict": "男主独闯中州寻龙蛋，女主追至中州。成仙坛阴谋初露，方天与罗天安浮出水面。男主放弃失忆伪装。",
      "setting_features": "中州各城池、祭坛、北境<location>。世界观格局从宗门扩展到大陆级别的生死博弈。"
    },
    {
      "name": "帝陨秘境篇",
      "chapter_range": "约169-243",
      "core_conflict": "三年修炼后进入帝陨秘境。男女主在秘境中感情大幅推进至道侣。幻天大帝传承、身份真相揭露。",
      "setting_features": "帝陨秘境——地底迷宫、寒泉灵潭、幻天莹寝宫。封闭空间中的冒险与感情深化。"
    },
    {
      "name": "太古时代篇",
      "chapter_range": "约244-313",
      "core_conflict": "男主独行冒险后与女主在荒禁相聚。穿越到太古时代参加气运战界，击败林凡等天骄晋升准帝。",
      "setting_features": "东荒→荒禁禁地→太古时代天琼大陆。时空穿越，太古时代势力格局。"
    },
    {
      "name": "备战决战篇",
      "chapter_range": "约314-389",
      "core_conflict": "回归天苍后全力备战。玄海大陆之行、太上神宗探索、准帝巅峰突破。最终天苍大劫爆发，男主以命换命击杀方天后身死。",
      "setting_features": "天苍大陆→玄海大陆→太上神宗→成仙主坛。从积蓄力量到全面战争的升级过程。"
    },
    {
      "name": "仙界篇",
      "chapter_range": "约390-502",
      "core_conflict": "男主在仙界第十世复活，女主记忆被封存。从重逢、记忆恢复到成亲。解决萧浩天魔化、冷凝月逃婚等支线。攻略任务完成获得无敌，前往冥界复活亡友。",
      "setting_features": "仙界九州——道天仙府、界州镇魔城、寒州冰渊。仙界势力格局与大千世界层级揭示。"
    },
    {
      "name": "蓝星篇",
      "chapter_range": "约503-537",
      "core_conflict": "众人离开修仙界定居蓝星。现代日常生活、领结婚证、游乐园约会。怀孕生双胞胎，全员回归蓝星定居。",
      "setting_features": "蓝星（地球）现代都市。修仙者体验凡人生活的轻松日常。"
    }
  ],
  "core_rules": [
    "九命机制：男主拥有系统赋予的九条命。前八世均死于<character>之手，第九世为最后一条命。第九世身死后系统耗费数十亿本源点和数百年时间复活男主（第十世）。",
    "系统与本源点：男主拥有主神级系统，可通过本源点兑换物品、技能、复活等。本源点来源为吞噬其他系统、出售宝物、任务奖励等。系统具有独特情感，是男主唯一宿主。",
    "<technique>限制：女主修炼的<technique>要求大帝境前不可失身，否则寒阴之气散失、修为倒退。此限制是两人感情推进的核心障碍之一。",
    "大道之女：女主被揭示为'大道之女'，本应注定主宰大千世界。男主通过攻略任务完成后获得的无敌力量，本质是系统窃取的大道力量。",
    "天道规则：天道是活跃的意志体，会降下雷劫惩罚违规者，会镇压超出时代的存在。可与之签订契约、甚至战斗。",
    "日月姻缘镯：男女主各佩戴日色/月色镯子，化入体内后在两人手腕上隐现镯纹，会在关键时刻影响双方心绪、促进感情。",
    "成仙坛机制：以无数生灵血祭换取成仙的禁忌之法。方天在两片大陆布局主坛与十大副坛，企图牺牲两大陆所有生灵成仙。",
    "往生术：男主后期获得的逆天神通，可将亡魂回溯往生、恢复生前肉身。不可外传。",
    "时空法则：荒禁禁地蕴含时间法则，可触发时空回溯穿越到太古时代。气运战界连接不同时代的天骄。"
  ]
}
